{
  "$schema": "https://json-schema.org/draft/2020-12/schema",
  "title": "Internal Results Surface",
  "type": "object",
  "required": [
    "version",
    "band_groups",
    "shortlists",
    "skill_details",
    "better_alternatives"
  ],
  "properties": {
    "version": {
      "type": "string"
    },
    "band_groups": {
      "type": "array",
      "items": { "type": "object" }
    },
    "shortlists": {
      "type": "array",
      "items": { "type": "object" }
    },
    "skill_details": {
      "type": "array",
      "items": { "type": "object" }
    },
    "better_alternatives": {
      "type": "array",
      "items": { "type": "object" }
    }
  },
  "additionalProperties": false
}
